{
  "id": 1, 
  "firstname": "Donald",
  "lastname": "Trump",
  "photoUser":"eff60af78d1ded9d62fcff68f84370ee", 
  "description": "This is a longer card with supporting text below as a natural lead-in to additional content. This content is a little bit longer.",
  "date": "15/04/2021",
  "publicationPhoto":"96a3be3cf272e017046d1b2674a52bd3"
}